{
  "format": "mooyu.curriculum-knowledge-map-fragment",
  "schemaVersion": 1,
  "id": "cn-hs.physics.required.2017-2020",
  "subjectId": "physics",
  "nodes": [
    { "id": "cn-hs.physics.required-1", "subjectId": "physics", "parentId": "cn-hs.physics", "type": "module", "title": { "zh-CN": "必修 1", "en": "Required Physics 1" }, "curriculumLevels": ["required"], "standardRefs": [{ "authorityId": "moe.cn-hs-2017-2020-bundle", "locator": "PDF 8，第20-23页：必修1", "scope": "verbatim" }], "representations": ["verbal", "symbolic", "graph", "diagram", "experimental"], "observableVariables": [], "interactionCandidates": ["motion-lab", "force-builder", "experiment-workflow"], "review": { "status": "source-checked", "sourceChecked": true, "subjectChecked": false } },
    { "id": "cn-hs.physics.required-1.motion-models", "subjectId": "physics", "parentId": "cn-hs.physics.required-1", "type": "module", "title": { "zh-CN": "机械运动与物理模型", "en": "Mechanical Motion and Physical Models" }, "curriculumLevels": ["required"], "standardRefs": [{ "authorityId": "moe.cn-hs-2017-2020-bundle", "locator": "PDF 8，第20-21页：1.1", "scope": "verbatim" }], "representations": ["verbal", "symbolic", "graph", "diagram", "experimental"], "observableVariables": [], "interactionCandidates": ["motion-lab", "model-builder"], "review": { "status": "source-checked", "sourceChecked": true, "subjectChecked": false } },
    { "id": "cn-hs.physics.required-1.experimental-science", "subjectId": "physics", "parentId": "cn-hs.physics.required-1.motion-models", "type": "practice", "title": { "zh-CN": "近代实验科学与证据方法", "en": "Modern Experimental Science and Evidence" }, "curriculumLevels": ["required"], "standardRefs": [{ "authorityId": "moe.cn-hs-2017-2020-bundle", "locator": "PDF 8，第20页：1.1.1", "scope": "verbatim" }], "representations": ["verbal", "experimental", "timeline"], "observableVariables": ["question", "evidence", "inference"], "interactionCandidates": ["experiment-workflow", "evidence-board", "timeline"], "review": { "status": "source-checked", "sourceChecked": true, "subjectChecked": false } },
    { "id": "cn-hs.physics.required-1.particle-model", "subjectId": "physics", "parentId": "cn-hs.physics.required-1.motion-models", "type": "model", "title": { "zh-CN": "质点模型及其适用条件", "en": "Particle Model and Its Applicability" }, "curriculumLevels": ["required"], "standardRefs": [{ "authorityId": "moe.cn-hs-2017-2020-bundle", "locator": "PDF 8，第20页：1.1.2", "scope": "verbatim" }], "representations": ["verbal", "diagram", "temporal"], "observableVariables": ["object-size", "motion-scale", "orientation-relevance"], "interactionCandidates": ["model-toggle", "scale-compare", "applicability-check"], "review": { "status": "source-checked", "sourceChecked": true, "subjectChecked": false } },
    { "id": "cn-hs.physics.required-1.kinematics", "subjectId": "physics", "parentId": "cn-hs.physics.required-1.motion-models", "type": "model", "title": { "zh-CN": "位移、速度、加速度与匀变速直线运动", "en": "Displacement, Velocity, Acceleration, and Uniformly Accelerated Motion" }, "curriculumLevels": ["required"], "standardRefs": [{ "authorityId": "moe.cn-hs-2017-2020-bundle", "locator": "PDF 8，第20-21页：1.1.3", "scope": "verbatim" }], "representations": ["symbolic", "graph", "table", "temporal", "experimental"], "observableVariables": ["position", "displacement", "velocity", "acceleration", "time"], "interactionCandidates": ["motion-lab", "timeline", "graph-scrubber", "representation-switch", "experiment-workflow"], "review": { "status": "source-checked", "sourceChecked": true, "subjectChecked": false } },
    { "id": "cn-hs.physics.required-1.free-fall", "subjectId": "physics", "parentId": "cn-hs.physics.required-1.motion-models", "type": "model", "title": { "zh-CN": "自由落体运动与实验推理", "en": "Free Fall and Experimental Reasoning" }, "curriculumLevels": ["required"], "standardRefs": [{ "authorityId": "moe.cn-hs-2017-2020-bundle", "locator": "PDF 8，第21页：1.1.4", "scope": "verbatim" }], "representations": ["verbal", "symbolic", "graph", "temporal", "experimental"], "observableVariables": ["height", "time", "velocity", "gravity", "air-resistance"], "interactionCandidates": ["fall-simulation", "air-resistance-toggle", "graph-scrubber", "experiment-workflow"], "review": { "status": "source-checked", "sourceChecked": true, "subjectChecked": false } },
    { "id": "cn-hs.physics.required-1.interaction-laws", "subjectId": "physics", "parentId": "cn-hs.physics.required-1", "type": "module", "title": { "zh-CN": "相互作用与运动定律", "en": "Interactions and Laws of Motion" }, "curriculumLevels": ["required"], "standardRefs": [{ "authorityId": "moe.cn-hs-2017-2020-bundle", "locator": "PDF 8，第21-22页：1.2", "scope": "verbatim" }], "representations": ["verbal", "symbolic", "diagram", "experimental"], "observableVariables": [], "interactionCandidates": ["force-builder", "free-body-diagram", "experiment-workflow"], "review": { "status": "source-checked", "sourceChecked": true, "subjectChecked": false } },
    { "id": "cn-hs.physics.required-1.forces-hooke-friction", "subjectId": "physics", "parentId": "cn-hs.physics.required-1.interaction-laws", "type": "principle", "title": { "zh-CN": "重力、弹力、胡克定律与摩擦力", "en": "Gravity, Elasticity, Hooke's Law, and Friction" }, "curriculumLevels": ["required"], "standardRefs": [{ "authorityId": "moe.cn-hs-2017-2020-bundle", "locator": "PDF 8，第21页：1.2.1", "scope": "verbatim" }], "representations": ["symbolic", "graph", "diagram", "experimental"], "observableVariables": ["mass", "gravity", "extension", "spring-constant", "normal-force", "friction-coefficient"], "interactionCandidates": ["spring-lab", "friction-lab", "force-probe", "graph-scrubber"], "review": { "status": "source-checked", "sourceChecked": true, "subjectChecked": false } },
    { "id": "cn-hs.physics.required-1.force-composition-equilibrium", "subjectId": "physics", "parentId": "cn-hs.physics.required-1.interaction-laws", "type": "method", "title": { "zh-CN": "力的合成、分解与共点力平衡", "en": "Force Composition, Decomposition, and Equilibrium" }, "curriculumLevels": ["required"], "standardRefs": [{ "authorityId": "moe.cn-hs-2017-2020-bundle", "locator": "PDF 8，第21页：1.2.2", "scope": "verbatim" }], "representations": ["symbolic", "diagram", "experimental"], "observableVariables": ["force-x", "force-y", "resultant", "equilibrium"], "interactionCandidates": ["force-builder", "component-decomposition", "free-body-diagram", "equilibrium-check"], "review": { "status": "source-checked", "sourceChecked": true, "subjectChecked": false } },
    { "id": "cn-hs.physics.required-1.newton-laws", "subjectId": "physics", "parentId": "cn-hs.physics.required-1.interaction-laws", "type": "principle", "title": { "zh-CN": "牛顿运动定律、超重与失重", "en": "Newton's Laws, Apparent Weight, and Weightlessness" }, "curriculumLevels": ["required"], "standardRefs": [{ "authorityId": "moe.cn-hs-2017-2020-bundle", "locator": "PDF 8，第21-22页：1.2.3", "scope": "verbatim" }], "representations": ["verbal", "symbolic", "graph", "diagram", "experimental"], "observableVariables": ["force", "mass", "acceleration", "apparent-weight"], "interactionCandidates": ["newton-lab", "free-body-diagram", "mass-force-sweep", "elevator-simulation"], "review": { "status": "source-checked", "sourceChecked": true, "subjectChecked": false } },

    { "id": "cn-hs.physics.required-2", "subjectId": "physics", "parentId": "cn-hs.physics", "type": "module", "title": { "zh-CN": "必修 2", "en": "Required Physics 2" }, "curriculumLevels": ["required"], "standardRefs": [{ "authorityId": "moe.cn-hs-2017-2020-bundle", "locator": "PDF 8，第23-27页：必修2", "scope": "verbatim" }], "representations": ["verbal", "symbolic", "graph", "diagram", "experimental"], "observableVariables": [], "interactionCandidates": ["energy-lab", "trajectory-lab", "orbit-simulation"], "review": { "status": "source-checked", "sourceChecked": true, "subjectChecked": false } },
    { "id": "cn-hs.physics.required-2.mechanical-energy", "subjectId": "physics", "parentId": "cn-hs.physics.required-2", "type": "module", "title": { "zh-CN": "机械能及其守恒定律", "en": "Mechanical Energy and Conservation" }, "curriculumLevels": ["required"], "standardRefs": [{ "authorityId": "moe.cn-hs-2017-2020-bundle", "locator": "PDF 8，第23-24页：2.1", "scope": "verbatim" }], "representations": ["symbolic", "graph", "diagram", "experimental"], "observableVariables": [], "interactionCandidates": ["energy-lab", "energy-bar-chart"], "review": { "status": "source-checked", "sourceChecked": true, "subjectChecked": false } },
    { "id": "cn-hs.physics.required-2.work-power", "subjectId": "physics", "parentId": "cn-hs.physics.required-2.mechanical-energy", "type": "concept", "title": { "zh-CN": "功与功率", "en": "Work and Power" }, "curriculumLevels": ["required"], "standardRefs": [{ "authorityId": "moe.cn-hs-2017-2020-bundle", "locator": "PDF 8，第23页：2.1.1", "scope": "verbatim" }], "representations": ["verbal", "symbolic", "graph", "diagram"], "observableVariables": ["force", "displacement", "angle", "work", "power", "velocity"], "interactionCandidates": ["work-visualization", "force-angle-sweep", "power-probe"], "review": { "status": "source-checked", "sourceChecked": true, "subjectChecked": false } },
    { "id": "cn-hs.physics.required-2.kinetic-energy-theorem", "subjectId": "physics", "parentId": "cn-hs.physics.required-2.mechanical-energy", "type": "principle", "title": { "zh-CN": "动能与动能定理", "en": "Kinetic Energy and Work-Energy Theorem" }, "curriculumLevels": ["required"], "standardRefs": [{ "authorityId": "moe.cn-hs-2017-2020-bundle", "locator": "PDF 8，第23-24页：2.1.2", "scope": "verbatim" }], "representations": ["symbolic", "graph", "diagram"], "observableVariables": ["mass", "velocity", "kinetic-energy", "net-work"], "interactionCandidates": ["energy-bar-chart", "work-energy-trace", "parameter-sweep"], "review": { "status": "source-checked", "sourceChecked": true, "subjectChecked": false } },